
.
 MySQL  localhost:3306 ssl  SQL > show databases;
+--------------------+
| Database           |
+--------------------+
| d9                 |
| d9r                |
| emp                |
| employees          |
| food_items         |
| food_names         |
| information_schema |
| keyd9              |
| mysql              |
| operators          |
| performance_schema |
| restaurant         |
| sales              |
| sys                |
| tv                 |
+--------------------+
15 rows in set (0.0018 sec)
 MySQL  localhost:3306 ssl  SQL > use sales;
Default schema set to `sales`.
Fetching global names, object names from `sales` for auto-completion... Press ^C to stop.
 MySQL  localhost:3306 ssl  sales  SQL > create table sales
                                      -> sale_id int primary key,
                                      -> product_name varchar(50),
                                      -> quantity int,
                                      -> price int);
ERROR: 1064 (42000): You have an error in your SQL syntax; check the manual that corresponds to your MySQL server version for the right syntax to use near 'sale_id int primary key,
product_name varchar(50),
quantity int,
price int)' at line 2
 MySQL  localhost:3306 ssl  sales  SQL > create table sales (sale_id int primary key, product_name varchar(50), quantity int, price int);
Query OK, 0 rows affected (0.0805 sec)
 MySQL  localhost:3306 ssl  sales  SQL > select * from sales;
Empty set (0.0036 sec)
 MySQL  localhost:3306 ssl  sales  SQL > desc sales;
+--------------+-------------+------+-----+---------+-------+
| Field        | Type        | Null | Key | Default | Extra |
+--------------+-------------+------+-----+---------+-------+
| sale_id      | int         | NO   | PRI | NULL    |       |
| product_name | varchar(50) | YES  |     | NULL    |       |
| quantity     | int         | YES  |     | NULL    |       |
| price        | int         | YES  |     | NULL    |       |
+--------------+-------------+------+-----+---------+-------+
4 rows in set (0.0031 sec)
 MySQL  localhost:3306 ssl  sales  SQL > insert into values(1,'laptop',2,50000);

 MySQL  localhost:3306 ssl  sales  SQL > insert into sales values(21,'laptop',2,50000);
Query OK, 1 row affected (0.0312 sec)
 MySQL  localhost:3306 ssl  sales  SQL > select * from sales;
+---------+--------------+----------+-------+
| sale_id | product_name | quantity | price |
+---------+--------------+----------+-------+
|      21 | laptop       |        2 | 50000 |
+---------+--------------+----------+-------+
1 row in set (0.0041 sec)
 MySQL  localhost:3306 ssl  sales  SQL > insert into sales values(22,'mobile',3,20000),
                                      -> (23,'headphones',4,2000),
                                      -> (24,'keyboard',1,1500),
                                      -> (25,'mouse',5,800);
Query OK, 4 rows affected (0.0273 sec)

Records: 4  Duplicates: 0  Warnings: 0
 MySQL  localhost:3306 ssl  sales  SQL > select
                                      -> * from sales;
+---------+--------------+----------+-------+
| sale_id | product_name | quantity | price |
+---------+--------------+----------+-------+
|      21 | laptop       |        2 | 50000 |
|      22 | mobile       |        3 | 20000 |
|      23 | headphones   |        4 |  2000 |
|      24 | keyboard     |        1 |  1500 |
|      25 | mouse        |        5 |   800 |
+---------+--------------+----------+-------+
5 rows in set (0.0011 sec)
 MySQL  localhost:3306 ssl  sales  SQL > select sum(quantity * price) as total_revenue from sales;
+---------------+
| total_revenue |
+---------------+
|        173500 |
+---------------+
1 row in set (0.0260 sec)
 MySQL  localhost:3306 ssl  sales  SQL > select max(salary) - min(salary) as salary_difference from employees;
ERROR: 1146 (42S02): Table 'sales.employees' doesn't exist
 MySQL  localhost:3306 ssl  sales  SQL > show tables;
+-----------------+
| Tables_in_sales |
+-----------------+
| sales           |
+-----------------+
1 row in set (0.0259 sec)
 MySQL  localhost:3306 ssl  sales  SQL > show databases;
+--------------------+
| Database           |
+--------------------+
| d9                 |
| d9r                |
| emp                |
| employees          |
| food_items         |
| food_names         |
| information_schema |
| keyd9              |
| mysql              |
| operators          |
| performance_schema |
| restaurant         |
| sales              |
| sys                |
| tv                 |
+--------------------+
15 rows in set (0.0022 sec)
 MySQL  localhost:3306 ssl  sales  SQL > drop database employees;
Query OK, 0 rows affected (0.0318 sec)
 MySQL  localhost:3306 ssl  sales  SQL > create table employees;
ERROR: 4028 (HY000): A table must have at least one visible column.
 MySQL  localhost:3306 ssl  sales  SQL > create database employees;
Query OK, 1 row affected (0.0282 sec)
 MySQL  localhost:3306 ssl  sales  SQL > use employees;
Default schema set to `employees`.
Fetching global names, object names from `employees` for auto-completion... Press ^C to stop.
 MySQL  localhost:3306 ssl  employees  SQL > create table employees;
ERROR: 4028 (HY000): A table must have at least one visible column.
 MySQL  localhost:3306 ssl  employees  SQL > create table employees(emp_id int,emp_name varchar(50),salary int);
Query OK, 0 rows affected (0.0519 sec)
 MySQL  localhost:3306 ssl  employees  SQL > desc employees;
+----------+-------------+------+-----+---------+-------+
| Field    | Type        | Null | Key | Default | Extra |
+----------+-------------+------+-----+---------+-------+
| emp_id   | int         | YES  |     | NULL    |       |
| emp_name | varchar(50) | YES  |     | NULL    |       |
| salary   | int         | YES  |     | NULL    |       |
+----------+-------------+------+-----+---------+-------+
3 rows in set (0.0034 sec)
 MySQL  localhost:3306 ssl  employees  SQL > insert into employees values (1,'a',30000),
                                          -> (2,'b',50000),
                                          -> (3,'c',40000);
Query OK, 3 rows affected (0.0276 sec)

Records: 3  Duplicates: 0  Warnings: 0
 MySQL  localhost:3306 ssl  employees  SQL > select * from employees;
+--------+----------+--------+
| emp_id | emp_name | salary |
+--------+----------+--------+
|      1 | a        |  30000 |
|      2 | b        |  50000 |
|      3 | c        |  40000 |
+--------+----------+--------+
3 rows in set (0.0011 sec)
 MySQL  localhost:3306 ssl  employees  SQL > select max(salary)-min(salary) as salary_difference from employees;
+-------------------+
| salary_difference |
+-------------------+
|             20000 |
+-------------------+
1 row in set (0.0231 sec)
 MySQL  localhost:3306 ssl  employees  SQL > create table students(student_id int,
                                          -> students_name varchar(50),
                                          -> marks int);
Query OK, 0 rows affected (0.0526 sec)
 MySQL  localhost:3306 ssl  employees  SQL > select * from students;
Empty set (0.0023 sec)
 MySQL  localhost:3306 ssl  employees  SQL > desc students;
+---------------+-------------+------+-----+---------+-------+
| Field         | Type        | Null | Key | Default | Extra |
+---------------+-------------+------+-----+---------+-------+
| student_id    | int         | YES  |     | NULL    |       |
| students_name | varchar(50) | YES  |     | NULL    |       |
| marks         | int         | YES  |     | NULL    |       |
+---------------+-------------+------+-----+---------+-------+
3 rows in set (0.0028 sec)
 MySQL  localhost:3306 ssl  employees  SQL > insert into students values (1,'ravi',85),
                                          -> (2,'sita',90),
                                          -> (3,'anu',null),
                                          -> (4,'manoj',88);
Query OK, 4 rows affected (0.0268 sec)

Records: 4  Duplicates: 0  Warnings: 0
 MySQL  localhost:3306 ssl  employees  SQL > select * from students;
+------------+---------------+-------+
| student_id | students_name | marks |
+------------+---------------+-------+
|          1 | ravi          |    85 |
|          2 | sita          |    90 |
|          3 | anu           |  NULL |
|          4 | manoj         |    88 |
+------------+---------------+-------+
4 rows in set (0.0010 sec)
 MySQL  localhost:3306 ssl  employees  SQL > select sum(marks) as total_marks from students;
+-------------+
| total_marks |
+-------------+
|         263 |
+-------------+
1 row in set (0.0010 sec)
 MySQL  localhost:3306 ssl  employees  SQL > select * from students;
+------------+---------------+-------+
| student_id | students_name | marks |
+------------+---------------+-------+
|          1 | ravi          |    85 |
|          2 | sita          |    90 |
|          3 | anu           |  NULL |
|          4 | manoj         |    88 |
+------------+---------------+-------+
4 rows in set (0.0011 sec)
 MySQL  localhost:3306 ssl  employees  SQL > select count(salary) as salary_count from employees;
+--------------+
| salary_count |
+--------------+
|            3 |
+--------------+
1 row in set (0.0015 sec)
 MySQL  localhost:3306 ssl  employees  SQL > select avg(price * 1.10) as avg_price_after_increase from products;
ERROR: 1146 (42S02): Table 'employees.products' doesn't exist
 MySQL  localhost:3306 ssl  employees  SQL > select avg(price * 1.10) as avg_price_after_increase from  sales products;
ERROR: 1146 (42S02): Table 'employees.sales' doesn't exist
 MySQL  localhost:3306 ssl  employees  SQL > select * from sales;
ERROR: 1146 (42S02): Table 'employees.sales' doesn't exist
 MySQL  localhost:3306 ssl  employees  SQL > desc sales;
ERROR: 1146 (42S02): Table 'employees.sales' doesn't exist
 MySQL  localhost:3306 ssl  employees  SQL > select databases;
ERROR: 1064 (42000): You have an error in your SQL syntax; check the manual that corresponds to your MySQL server version for the right syntax to use near 'databases' at line 1
 MySQL  localhost:3306 ssl  employees  SQL > select database();
+------------+
| database() |
+------------+
| employees  |
+------------+
1 row in set (0.0009 sec)
 MySQL  localhost:3306 ssl  employees  SQL > use employees;
Default schema set to `employees`.
Fetching global names, object names from `employees` for auto-completion... Press ^C to stop.
 MySQL  localhost:3306 ssl  employees  SQL > show tables;
+---------------------+
| Tables_in_employees |
+---------------------+
| employees           |
| students            |
+---------------------+
2 rows in set (0.0030 sec)
 MySQL  localhost:3306 ssl  employees  SQL > select avg(price * 1.10) as avg_price_after_increase from products;
ERROR: 1146 (42S02): Table 'employees.products' doesn't exist
 MySQL  localhost:3306 ssl  employees  SQL > show datasaes;
ERROR: 1064 (42000): You have an error in your SQL syntax; check the manual that corresponds to your MySQL server version for the right syntax to use near 'datasaes' at line 1
 MySQL  localhost:3306 ssl  employees  SQL > show databases;
+--------------------+
| Database           |
+--------------------+
| d9                 |
| d9r                |
| emp                |
| employees          |
| food_items         |
| food_names         |
| information_schema |
| keyd9              |
| mysql              |
| operators          |
| performance_schema |
| restaurant         |
| sales              |
| sys                |
| tv                 |
+--------------------+
15 rows in set (0.0019 sec)
 MySQL  localhost:3306 ssl  employees  SQL > use sales;
Default schema set to `sales`.
Fetching global names, object names from `sales` for auto-completion... Press ^C to stop.
 MySQL  localhost:3306 ssl  sales  SQL > select avg(price * 1.10) as avg_price_after_increase from products;
ERROR: 1146 (42S02): Table 'sales.products' doesn't exist
 MySQL  localhost:3306 ssl  sales  SQL > desc sales;
+--------------+-------------+------+-----+---------+-------+
| Field        | Type        | Null | Key | Default | Extra |
+--------------+-------------+------+-----+---------+-------+
| sale_id      | int         | NO   | PRI | NULL    |       |
| product_name | varchar(50) | YES  |     | NULL    |       |
| quantity     | int         | YES  |     | NULL    |       |
| price        | int         | YES  |     | NULL    |       |
+--------------+-------------+------+-----+---------+-------+
4 rows in set (0.0024 sec)
 MySQL  localhost:3306 ssl  sales  SQL > select * from sales;
+---------+--------------+----------+-------+
| sale_id | product_name | quantity | price |
+---------+--------------+----------+-------+
|      21 | laptop       |        2 | 50000 |
|      22 | mobile       |        3 | 20000 |
|      23 | headphones   |        4 |  2000 |
|      24 | keyboard     |        1 |  1500 |
|      25 | mouse        |        5 |   800 |
+---------+--------------+----------+-------+
5 rows in set (0.0008 sec)
 MySQL  localhost:3306 ssl  sales  SQL > select avg(price * 1.10) as avg_price_after_increase from products;
ERROR: 1146 (42S02): Table 'sales.products' doesn't exist
 MySQL  localhost:3306 ssl  sales  SQL > select avg(price * 1.10) as avg_price_after_increase from sales;
+--------------------------+
| avg_price_after_increase |
+--------------------------+
|             16346.000000 |
+--------------------------+
1 row in set (0.0234 sec)
 MySQL  localhost:3306 ssl  sales  SQL > select avg(price * 1.10) as avg_price_after_increase from products;
ERROR: 1146 (42S02): Table 'sales.products' doesn't exist
 MySQL  localhost:3306 ssl  sales  SQL > select sum(salary * 0.05) as total_bonus from employees;
ERROR: 1146 (42S02): Table 'sales.employees' doesn't exist
 MySQL  localhost:3306 ssl  sales  SQL > show databases;
+--------------------+
| Database           |
+--------------------+
| d9                 |
| d9r                |
| emp                |
| employees          |
| food_items         |
| food_names         |
| information_schema |
| keyd9              |
| mysql              |
| operators          |
| performance_schema |
| restaurant         |
| sales              |
| sys                |
| tv                 |
+--------------------+
15 rows in set (0.0025 sec)
 MySQL  localhost:3306 ssl  sales  SQL > use employees;
Default schema set to `employees`.
Fetching global names, object names from `employees` for auto-completion... Press ^C to stop.
 MySQL  localhost:3306 ssl  employees  SQL > select * from employees;
+--------+----------+--------+
| emp_id | emp_name | salary |
+--------+----------+--------+
|      1 | a        |  30000 |
|      2 | b        |  50000 |
|      3 | c        |  40000 |
+--------+----------+--------+
3 rows in set (0.0008 sec)
 MySQL  localhost:3306 ssl  employees  SQL > select sum(salary * 0.05) as total_bonus from employees;
+-------------+
| total_bonus |
+-------------+
|     6000.00 |
+-------------+
1 row in set (0.0009 sec)
 MySQL  localhost:3306 ssl  employees  SQL > show databases;
+--------------------+
| Database           |
+--------------------+
| d9                 |
| d9r                |
| emp                |
| employees          |
| food_items         |
| food_names         |
| information_schema |
| keyd9              |
| mysql              |
| operators          |
| performance_schema |
| restaurant         |
| sales              |
| sys                |
| tv                 |
+--------------------+
15 rows in set (0.0020 sec)
 MySQL  localhost:3306 ssl  employees  SQL > use sales;
Default schema set to `sales`.
Fetching global names, object names from `sales` for auto-completion... Press ^C to stop.
 MySQL  localhost:3306 ssl  sales  SQL > select * from sales;
+---------+--------------+----------+-------+
| sale_id | product_name | quantity | price |
+---------+--------------+----------+-------+
|      21 | laptop       |        2 | 50000 |
|      22 | mobile       |        3 | 20000 |
|      23 | headphones   |        4 |  2000 |
|      24 | keyboard     |        1 |  1500 |
|      25 | mouse        |        5 |   800 |
+---------+--------------+----------+-------+
5 rows in set (0.0012 sec)
 MySQL  localhost:3306 ssl  sales  SQL > select max(quantity * price) as highest_sale_amount from sales;
+---------------------+
| highest_sale_amount |
+---------------------+
|              100000 |
+---------------------+
1 row in set (0.0012 sec)
 MySQL  localhost:3306 ssl  sales  SQL > use employees;
Default schema set to `employees`.
Fetching global names, object names from `employees` for auto-completion... Press ^C to stop.
 MySQL  localhost:3306 ssl  employees  SQL > select * from employees;
+--------+----------+--------+
| emp_id | emp_name | salary |
+--------+----------+--------+
|      1 | a        |  30000 |
|      2 | b        |  50000 |
|      3 | c        |  40000 |
+--------+----------+--------+
3 rows in set (0.0011 sec)
 MySQL  localhost:3306 ssl  employees  SQL > select count(distinct department_id) as total_departments from employees;
ERROR: 1054 (42S22): Unknown column 'department_id' in 'field list'
 MySQL  localhost:3306 ssl  employees  SQL > select count(*) from employees;
+----------+
| count(*) |
+----------+
|        3 |
+----------+
1 row in set (0.0263 sec)
 MySQL  localhost:3306 ssl  employees  SQL > alter table employees
                                          -> add department_id int;
Query OK, 0 rows affected (0.0465 sec)

Records: 0  Duplicates: 0  Warnings: 0
 MySQL  localhost:3306 ssl  employees  SQL > select * from employees;
+--------+----------+--------+---------------+
| emp_id | emp_name | salary | department_id |
+--------+----------+--------+---------------+
|      1 | a        |  30000 |          NULL |
|      2 | b        |  50000 |          NULL |
|      3 | c        |  40000 |          NULL |
+--------+----------+--------+---------------+
3 rows in set (0.0013 sec)
 MySQL  localhost:3306 ssl  employees  SQL > desc employees;
+---------------+-------------+------+-----+---------+-------+
| Field         | Type        | Null | Key | Default | Extra |
+---------------+-------------+------+-----+---------+-------+
| emp_id        | int         | YES  |     | NULL    |       |
| emp_name      | varchar(50) | YES  |     | NULL    |       |
| salary        | int         | YES  |     | NULL    |       |
| department_id | int         | YES  |     | NULL    |       |
+---------------+-------------+------+-----+---------+-------+
4 rows in set (0.0035 sec)
 MySQL  localhost:3306 ssl  employees  SQL > update employees set department_id = 10 where emp_id=1,
                                          -> ;
ERROR: 1064 (42000): You have an error in your SQL syntax; check the manual that corresponds to your MySQL server version for the right syntax to use near ',' at line 1
 MySQL  localhost:3306 ssl  employees  SQL > update employees set department_id = 10 where emp_id=1;
Query OK, 1 row affected (0.0281 sec)

Rows matched: 1  Changed: 1  Warnings: 0
 MySQL  localhost:3306 ssl  employees  SQL > select * from employees;
+--------+----------+--------+---------------+
| emp_id | emp_name | salary | department_id |
+--------+----------+--------+---------------+
|      1 | a        |  30000 |            10 |
|      2 | b        |  50000 |          NULL |
|      3 | c        |  40000 |          NULL |
+--------+----------+--------+---------------+
3 rows in set (0.0013 sec)
 MySQL  localhost:3306 ssl  employees  SQL > desc employees;
+---------------+-------------+------+-----+---------+-------+
| Field         | Type        | Null | Key | Default | Extra |
+---------------+-------------+------+-----+---------+-------+
| emp_id        | int         | YES  |     | NULL    |       |
| emp_name      | varchar(50) | YES  |     | NULL    |       |
| salary        | int         | YES  |     | NULL    |       |
| department_id | int         | YES  |     | NULL    |       |
+---------------+-------------+------+-----+---------+-------+
4 rows in set (0.0029 sec)
 MySQL  localhost:3306 ssl  employees  SQL > update employees set department_id = 20 where emp_id=2;
Query OK, 1 row affected (0.0066 sec)

Rows matched: 1  Changed: 1  Warnings: 0
 MySQL  localhost:3306 ssl  employees  SQL > update employees set department_id = 30 where emp_id=3;
Query OK, 1 row affected (0.0260 sec)

Rows matched: 1  Changed: 1  Warnings: 0
 MySQL  localhost:3306 ssl  employees  SQL > select 8 from employees;
+---+
| 8 |
+---+
| 8 |
| 8 |
| 8 |
+---+
3 rows in set (0.0008 sec)
 MySQL  localhost:3306 ssl  employees  SQL > select * from employees;
+--------+----------+--------+---------------+
| emp_id | emp_name | salary | department_id |
+--------+----------+--------+---------------+
|      1 | a        |  30000 |            10 |
|      2 | b        |  50000 |            20 |
|      3 | c        |  40000 |            30 |
+--------+----------+--------+---------------+
3 rows in set (0.0010 sec)
 MySQL  localhost:3306 ssl  employees  SQL > select count(distinct department_id) as total_departments from employees;
+-------------------+
| total_departments |
+-------------------+
|                 3 |
+-------------------+
1 row in set (0.0248 sec)
 MySQL  localhost:3306 ssl  employees  SQL > use sales;
Default schema set to `sales`.
Fetching global names, object names from `sales` for auto-completion... Press ^C to stop.
 MySQL  localhost:3306 ssl  sales  SQL > select * from sales;
+---------+--------------+----------+-------+
| sale_id | product_name | quantity | price |
+---------+--------------+----------+-------+
|      21 | laptop       |        2 | 50000 |
|      22 | mobile       |        3 | 20000 |
|      23 | headphones   |        4 |  2000 |
|      24 | keyboard     |        1 |  1500 |
|      25 | mouse        |        5 |   800 |
+---------+--------------+----------+-------+
5 rows in set (0.0016 sec)
 MySQL  localhost:3306 ssl  sales  SQL > select min(quqntity * price) as min_revenue from sales;
ERROR: 1054 (42S22): Unknown column 'quqntity' in 'field list'
 MySQL  localhost:3306 ssl  sales  SQL > select min(quantity * price) as min_revenue from sales;
+-------------+
| min_revenue |
+-------------+
|        1500 |
+-------------+
1 row in set (0.0009 sec)
 MySQL  localhost:3306 ssl  sales  SQL > use employees;
Default schema set to `employees`.
Fetching global names, object names from `employees` for auto-completion... Press ^C to stop.
 MySQL  localhost:3306 ssl  employees  SQL > select * from employees;
+--------+----------+--------+---------------+
| emp_id | emp_name | salary | department_id |
+--------+----------+--------+---------------+
|      1 | a        |  30000 |            10 |
|      2 | b        |  50000 |            20 |
|      3 | c        |  40000 |            30 |
+--------+----------+--------+---------------+
3 rows in set (0.0013 sec)
 MySQL  localhost:3306 ssl  employees  SQL > select round(avg(salary)) as rounded_avg_salary from employees;
+--------------------+
| rounded_avg_salary |
+--------------------+
|              40000 |
+--------------------+
1 row in set (0.0238 sec)
